Business Name,Phone Number,Address,Website,Emails,Search Phrase Used,Profile Category
Pickright Technologies,099722 89505,"Neil Rao Tower, Rao Tower, 118, Rd Number 3, Vijayanagar, EPIP Phase I, Whitefield, Bengaluru, Karnataka 560066, India",https://pickright.in/,,Stock Brokers in Whitefield Bangalore,Connector
Practicing Company Secretary Manali Shah,084601 81781,"C-201, VASWANI BRENTWOOD, near Vibgyor School, Thubarahalli, Whitefield, Bengaluru, Karnataka 560066, India",http://www.registermystartup.com/,,Company Secretaries in Whitefield Bangalore,Connector
NGC Auditors and Tax Service Point,097389 62455,"12 Satyanarayana swamy temple road, Immadihalli Main Rd, Channasandra, Whitefield, Bengaluru, Karnataka 560067, India",,,Auditing Firms in Whitefield Bangalore,Connector
Siva Krishna and Co,091821 70249,"Unit G1001, Ground floor, TOWER-A, ARDENTE OFFICE ONE, Hoodi Main Rd, Hoodi, Mahadevapura, Bengaluru, Karnataka 560048, India",http://www.sivakrishnaandco.com/,"contact@sivakrishnaandco.com, pettasivakrishna@gmail.com",Auditing Firms in Whitefield Bangalore,Connector
"Registration Guru - GST, BBMP FOOD LICENSE CONSULTANT IN BANGALORE ( WHITEFIELD)",078929 29155,"bhi, Shyanubhog Subbaiah Layout, Channasandra, Bengaluru, Karnataka 560067, India",http://www.registrationguru.org/,,GST Consultants in Whitefield Bangalore,Connector
For U GST and Tax Consultancy,099867 35110,"No 10, Muni Nanjnappa Building, 1st Floor, near Anjeneya Swamy temple, Mahadevapura, Bengaluru, Karnataka 560048, India",,,GST Consultants in Whitefield Bangalore,Connector
SBI Funds Management Limited,077100 71028,"2nd Floor, Sri Sai Harsha Towers, 183, Main Road, opposite Forum Neighborhood Mall, Palm Meadows, Whitefield, Bengaluru, Karnataka 560066, India",https://www.sbimf.com/,,Wealth Management in Whitefield Bangalore,Connector
Marvel Wealth Management,099727 00931,"Cluster_hagadur 5 Ncn Crystal, Gayathri Residency, G8, Springdale Layout Rd, Vijayanagar, Vijayanagara, Whitefield, Bengaluru, Karnataka 560066, India",,,Wealth Management in Whitefield Bangalore,Connector
LadCo Crest Wealth Management Services LLP,080 4093 0091,"Manipal Centre, 504, Dickenson Rd, Yellappa Garden, North Block, Sivanchetti Gardens, Bengaluru, Karnataka 560042, India",http://www.ladcocrest.com/,care@ladcocrest.com,Wealth Management in Whitefield Bangalore,Connector
ESGPro Mastery Institute,096117 17149,"104, ShareSpace, 88, Borewell Rd, opp. Whitefield, Palm Meadows, Postoffice, Whitefield, Bengaluru, Karnataka 560066, India",http://www.esgproinvest.com/,"info@domainname.com, info@esgproinvest.com",Banking Consultants in Whitefield Bangalore,Connector
Multinode Solutions,099800 97952,"14, Ramaswamy Layout, Immadihalli Main Road, Lane, adjacent AR Enterprises (battery dealer, Immadihalli, Whitefield, Bengaluru, Karnataka 560066, India",http://www.multinodesolutions.com/,info@multinodesolutions.com,Banking Consultants in Whitefield Bangalore,Connector
Anki reddy&Co,099085 13441,"4th floor, 4/1, Whitefield Main Rd, above ujjivan small finance bank, Happy Valley, Whitefield, Bengaluru, Karnataka 560066, India",,,Banking Consultants in Whitefield Bangalore,Connector
TOTALTAX CONSULTANTS,072592 52734,"Flat No.102, Patalamma Nilaya, 62/1, Siddhapura Main Rd, Palm Meadows, Nallurhalli, Whitefield, Bengaluru, Karnataka 560066, India",,,Banking Consultants in Whitefield Bangalore,Connector
Chartered Accountants,097312 33777,"921, 22nd Main, 24th Cross Rd, Garden Layout, Sector 2, HSR Layout, Bengaluru, Karnataka 560102, India",http://cainhsr.com/,,Chartered Accountants in HSR Layout Bangalore,Connector
P SINGHAL & CO (CHARTERED ACCOUNTANTS),096638 85797,"428, 1st Floor, 27th Main Rd, 1st Sector, HSR Layout, Bengaluru, Karnataka 560102, India",http://www.psinghal.com/,capankaj@psinghal.com,Chartered Accountants in HSR Layout Bangalore,Connector
AGARWAL AVINASH & CO.,097439 56549,"317 Ground Floor 24th cross, 27th Main Rd, 2nd Sector, Sector 2, HSR Layout, Bengaluru, Karnataka 560102, India",https://caagarwalavinash.com/,caavinash1985@gmail.com,Chartered Accountants in HSR Layout Bangalore,Connector
CFO Angle | Chartered Accountants | CFO Services | Financial Advisors,090710 12918,"4th Floor, No 280, 5th Main Rd, 6th Sector, HSR Layout, Bengaluru, Karnataka 560102, India",https://cfoangle.com/,info@cfoangle.com,Chartered Accountants in HSR Layout Bangalore,Connector
Ganesh Kumar J and Co,079752 61504,"1197, Falak Complex, Basement, 22nd Cross Rd, Parangi Palaya, Sector 2, HSR Layout, Bengaluru, Karnataka 560102, India",https://ganeshkumarjandco.in/,ganeshkumarjandco@gmail.com,Chartered Accountants in HSR Layout Bangalore,Connector
PINCHA and CO,080 4151 8686,"No 694/1,3rd Floor, 25th Cross, 9th Main Rd, 7th Sector, HSR Layout, Bengaluru, Karnataka 560102, India",http://www.pinchaca.com/,info@pinchaca.com,Chartered Accountants in HSR Layout Bangalore,Connector
HSR Advisory,093534 96516,"Office No 185, 1st Floor, 9th Main Rd, 7th Sector, HSR Layout, Bengaluru, Karnataka 560102, India",https://hsradvisory.in/,info@hsradvisory.in,Chartered Accountants in HSR Layout Bangalore,Connector
B H D & Associates Chartered Accountant,085558 97406,"1162 3rd Floor, 5th Main Rd, near Asha Tiffins, 7th Sector, HSR Layout, Bengaluru, Karnataka 560102, India",http://www.bhdandassociates.com/,info@bhdandassociates.com,Chartered Accountants in HSR Layout Bangalore,Connector
Mahal & Co - Best CA Firm in HSR Layout Bangalore,097033 03331,"4th Floor, Site 2, 12th Main Rd, near JSS Public School, 6th Sector, HSR Layout, Bengaluru, Karnataka 560102, India",https://www.mahalandco.in/,,Chartered Accountants in HSR Layout Bangalore,Connector
CA Saurabh Srivastava | Chartered Accountant | GST & Company Law Consultant | Startup Advisory | Business Valuation Services,099000 85630,"First Floor, 2363, 24th Main Rd, 1st Sector, HSR Layout, Bengaluru, Karnataka 560102, India",https://casaurabhsrivastava.com/,info@casaurabhsrivastava.com,Chartered Accountants in HSR Layout Bangalore,Connector
SUNIL & CO,082176 75117,"1st floor, Century Haven, 29/29, 24th Main Rd, Phase 3, Agara Village, 1st Sector, HSR Layout, Bengaluru, Karnataka 560102, India",https://suniltaxaccounts.com/,"info.suniltax@gmail.com, info@suniltaxaccounts.com",Chartered Accountants in HSR Layout Bangalore,Connector
Sai Taxation and Accounting services,090106 95188,"1, 24th Main Rd, Agara Village, 1st Sector, HSR Layout, Bengaluru, Karnataka 560102, India",https://www.facebook.com/profile.php?id=100079712655225,,Chartered Accountants in HSR Layout Bangalore,Connector
"CA. Satish S Biradar & Co., Chartered Accountants",099860 43154,"448, 28th Main, 10th Cross Rd, 1st Sector, HSR Layout, Bengaluru, Karnataka 560102, India",https://www.ssbandco.in/,,Chartered Accountants in HSR Layout Bangalore,Connector
Bhaskar Reddy V Chartered Accountant,094485 20019,"9th Main Rd, opposite to India Sweet House, 6th Sector, HSR Layout, Bengaluru, Karnataka 560102, India",,,Chartered Accountants in HSR Layout Bangalore,Connector
PRAVEEN KUMAR REDDY V & CO Chartered Accountants,097005 19541,"1215, Star Blue, M-Floor, Portion-B, HSR Club Road, 14th Main, 22nd Cross Rd, Sector 3, HSR Layout, Bengaluru, Karnataka 560102, India",,,Chartered Accountants in HSR Layout Bangalore,Connector
Steadfast Professionals,081050 36106,"106 Reliable Pride Somsundarpalya, circle, 7th Sector, HSR Layout, Bengaluru, Karnataka 560102, India",http://steadfastprofessionals.com/,steadfastprofs@gmail.com,Chartered Accountants in HSR Layout Bangalore,Connector
"G Raju & Co., Chartered Accountants",097390 63460,"2nd Floor, # 696 12th Cross, Land Mark: POLAM PRINTS, 27th Main Rd, 1st Sector, HSR Layout, Bengaluru, Karnataka 560102, India",http://www.grajuandco.com/,contact@webtel.in,Chartered Accountants in HSR Layout Bangalore,Connector
Priyanka & Swapna Chartered Accountants,099868 97685,"31, 2nd floor, 16th Main Rd, BTM 2nd Stage, Mahadeshwara Nagar, BTM Layout 2nd Stage, BTM Layout, Bengaluru, Karnataka 560076, India",https://www.bestcainbangalore.com/about-us.html,founders@priyankaandswapna.in,CA firms in HSR Layout Bangalore,Connector
PSR Accounting & Tax Solutions,098495 41284,"OFFICE NO. 185, 1ST FLOOR, 9th Main Rd, above MRF Tyre's showroom, 7th Sector, HSR Layout, Bengaluru, Karnataka 560102, India",,,CA firms in HSR Layout Bangalore,Connector
GOOD WILL GROUP OF AUDITORS & TAX PRACTITIONERS,099423 29555,"1ST FLOOR, BDA Complex, 28/A, near A2B RESTAURANT, Sector 6, HSR Layout, Bengaluru, Karnataka 560102, India",http://www.goodwillgroups.com/,,Tax Consultants in HSR Layout Bangalore,Connector
Choudhary Consultancy,070194 28760,"2103,first floor, 23rd main, 15th Cross Rd, Vanganahalli, 1st Sector, HSR Layout, Bengaluru, Karnataka 560102, India",,,Tax Consultants in HSR Layout Bangalore,Connector
SA Taxation and Accounting Services,078929 30338,"919-7, 5th Main Rd, 7th Sector, HSR Layout, Bengaluru, Karnataka 560102, India",https://sataxationandaccountingservices.com/,,Tax Consultants in HSR Layout Bangalore,Connector
Boston Financial Advisory Group,080 2572 4800,"#54, 3rd Floor, 13th Main 17th Cross Sector 6, Behind BDA Shopping Complex, Sector 6, HSR Layout, Bengaluru, Karnataka 560102, India",http://bostonfagroup.com/,,Financial Advisors in HSR Layout Bangalore,Connector
EFUNDZZ,090817 97979,"1st floor, 2079, 24th Main Rd, Vanganahalli, 1st Sector, HSR Layout, Bengaluru, Karnataka 560102, India",https://efundzz.com/,,Financial Advisors in HSR Layout Bangalore,Connector
FINTLIVEST,091487 85111,"4th Floor, 403, 22nd Cross Rd, Parangi Palaya, Sector 2, HSR Layout, Bengaluru, Karnataka 560102, India",http://fintlivest.com/,,Financial Advisors in HSR Layout Bangalore,Connector
Wealthmax,080 2572 3912,"No. 835, First Floor, 17th Main, 23rd Cross Rd, Sector 3, HSR Layout, Bengaluru, Karnataka 560102, India",,,Financial Advisors in HSR Layout Bangalore,Connector
S&B Financial services,080502 15163,"Shop no 5 , 1st floor, 1033, 24th Main Rd, 1st Sector, HSR Layout, Bengaluru, Karnataka 560102, India",,,Financial Advisors in HSR Layout Bangalore,Connector
Motilal Oswal Financial Services Limited,097310 16504,"No 202, 2nd Floor, 7th Cross Road, 28th Main Rd, 1st Sector, HSR Layout, Bengaluru, Karnataka 560102, India",https://stockbroker.motilaloswal.com/motilal-oswal-financial-services-limited-manpreet-singh-arora-stock-broker-sector-1-bengaluru-258642/Home?utm_source=locator&utm_medium=googleplaces,"bullseyefinserv@outlook.com, incredibleinv@gmail.com, bhat.kiran82@gmail.com, dinvestdvg@gmail.com, Support@Stamfordinvst.Com, ajitpattanayak76@gmail.com, preetykumari83@gamil.com, chandra3339@gmail.com, kriyafinserv25@gmail.com, gratiafinancialservices@gmail.com, manpreet181@gmail.com, angelinvestments21@gmail.com, sindhuambareesh@gmail.com",Financial Advisors in HSR Layout Bangalore,Connector
4thoughts Finance,080 4957 2237,"265, 16th Cross Rd, 8th Main, Sector 6, HSR Layout, Bengaluru, Karnataka 560102, India",https://www.4thoughtsfinance.com/,s.swati@4thoughtsfinance.com,Financial Advisors in HSR Layout Bangalore,Connector
HDFC Ergo Insurance Agent: Kanchan Mishra,091671 92050,"No G/06, CREATIVE RESIDENCY, 24th Main Rd, ITI Layout, Sector 2, HSR Layout, Bengaluru, Karnataka 560102, India",https://agent.hdfcergo.com/hdfc-ergo-insurance-agent-kanchan-mishra-insurance-broker-sector-2-bengaluru-312095/Home?utm_source=locator&utm_medium=googleplaces,"maanilkumar@rediffmail.com, info@credencefamilyoffice.com, shailaja216@gmail.com, gauravmishra.djjs@gmail.com, ravindranasingh15@gmail.com, indraprakash.reddy@gmail.com, teenajyothish@gmail.com, Rrp0077@Gmail.Com, krishnareddy123.k@gmail.com, gursimrankaurnarula@gmail.com, Vishwanath108@gmail.com, brsanjay@gmail.com",Insurance Agents in HSR Layout Bangalore,Connector
HDFC ERGO Insurance Agent: Kanchan Mishra,08071 888 361,"Ground Floor, No 524/A, 19th Main Rd, near Udupi Food Park, Sector 3, HSR Layout, Bengaluru, Karnataka 560102, India",https://agent.hdfcergo.com/hdfc-ergo-insurance-agent-kanchan-mishra-insurance-broker-sector-3-hsr-layout-bengaluru-347605/Home?utm_source=locator&utm_medium=googleplaces,"maanilkumar@rediffmail.com, info@credencefamilyoffice.com, shailaja216@gmail.com, gauravmishra.djjs@gmail.com, smaalan@gmail.com, ravindranasingh15@gmail.com, Rrp0077@Gmail.Com, indraprakash.reddy@gmail.com, teenajyothish@gmail.com, krishnareddy123.k@gmail.com, gursimrankaurnarula@gmail.com, Vishwanath108@gmail.com, brsanjay@gmail.com",Insurance Agents in HSR Layout Bangalore,Connector
Kokoro Insurance Brokers Pvt. Ltd,093798 53108,"36/5, 1st Floor ,Hustlehub Tech Park,, Somasundarapalya Main Rd, adjacent 27th Main Road,, ITI Layout, Sector 2, HSR Layout, HaralukunteVillage,, ITI Layout, Somasundarapalya, Bengaluru, Karnataka 560102, India",https://kokoroinsurance.com/,support@kokoroinsurance.com,Insurance Agents in HSR Layout Bangalore,Connector
BimaKavach,090365 54785,"3rd Floor, BimaKavach, 1203A, 25th B Main Rd, Sector 2, HSR Layout, Bengaluru, Karnataka 560102, India",http://www.bimakavach.com/,"support@bimakavach.com, namaste@bimakavach.com",Insurance Agents in HSR Layout Bangalore,Connector
LIC OF INDIA : life insurance advisor,094489 32549,"#34/36, 2nd cross, Old Mangammanapalya Rd, Hosapalaya, Muneshwara Nagar, Bengaluru, Karnataka 560068, India",,,Insurance Agents in HSR Layout Bangalore,Connector
HSR INSURANCE SPECIALIST (SGS Associates),094482 45956,"86, Mangammanapalya Main Rd, ITI Layout, 7th Sector, HSR Layout, Bengaluru, Karnataka 560068, India",,,Insurance Agents in HSR Layout Bangalore,Connector
99LifeInsurance,098450 41518,"250, 16th Main, 19th Cross Rd, Sector 3, HSR Layout, Bengaluru, Karnataka 560102, India",,,Insurance Agents in HSR Layout Bangalore,Connector
Pazcare,080 3783 4753,"2nd Floor, Urban Vault, 1371/29/1, 27th Main Rd, Somasundarapalya, Bengaluru, Karnataka 560102, India",https://www.pazcare.com/,support@pazcare.com,Insurance Agents in HSR Layout Bangalore,Connector
M-INSURE Services Pvt Ltd,081479 14590,"Third Floor, No.2737/1, 27th Main Rd, 1st Sector, HSR Layout, Bengaluru, Karnataka 560102, India",http://m-insure.in/,,Insurance Agents in HSR Layout Bangalore,Connector
ACKO GENERAL INSURANCE COMPANY LTD,1800 266 2256,"2347, Vanganahalli, 1st Sector, HSR Layout, Bengaluru, Karnataka 560102, India",,,Insurance Agents in HSR Layout Bangalore,Connector
SHIVARAM INSURANCE AGENCY,078929 59480,"#56/10, Shop No-4, Gurumurthy Swamy Complex Somasandrapalya, 2nd Sector, ITI Layout, 7th Sector, HSR Layout, Bengaluru, Karnataka 560102, India",http://www.licindia.com/,,Insurance Agents in HSR Layout Bangalore,Connector
"Sabka Policy – Insurance, RTO, Loans, Credit Cards, GST & Tax Services Under One Roof",084313 86428,"1, Anantam Heights, Chaitra Classic Layout, 7th Cross Rd, near Venkateswara Garment Shop, Bhagyalakshmi Avenue, Nyanappana Halli, Hulimavu, Bengaluru, Karnataka 560114, India",https://sabkafinancial.com/,"support@sabkafinancial.com, u003Esabkafinancial@gmail.com, sabkafinancial@gmail.com",Insurance Agents in HSR Layout Bangalore,Connector
Raksha Insurance,080 4210 9311,"5, Ramanna building, Mangammanapalya Main Rd, Opp, HSR Layout, Bengaluru, Karnataka 560068, India",,,Insurance Agents in HSR Layout Bangalore,Connector
OneClick PH Insurance Services,095454 50053,"KA 01 Central RTO Office No 4 , Sana Summit, 20th Main Road, RTO Office, 1st Cross Rd, near HSR, Agara Village, 1st Sector, HSR Layout, Bengaluru, Karnataka 560102, India",,,Insurance Agents in HSR Layout Bangalore,Connector
Balaji Properties,098453 55345,"No.1166, 25th Cross, 23rd Main Rd, Garden Layout, Sector 2, HSR Layout, Bengaluru, Karnataka 560102, India",,,Real Estate Agents in HSR Layout Bangalore,Connector
"Settlin, Property Consultancy",095900 39003,"Ground Floor, EBC Space 2, 19th Main Rd, Agara Village, 1st Sector, HSR Layout, Bengaluru, Karnataka 560102, India",https://settlin.in/,,Real Estate Agents in HSR Layout Bangalore,Connector
PLANETS PROPERTIES HSR BRANCH | Real Estate Property advisory company in Bangalore.,090199 11440,"141, 2nd Floor, Unit No.201, Teacher's Colony, Sector 5, 1st Block Koramangala, HSR Layout, Bengaluru, Karnataka 560102, India",,,Real Estate Agents in HSR Layout Bangalore,Connector
Maven Realty,097394 90514,"2nd Floor, 108, 27th Main Rd, opposite KLM Fashion Mall, 2nd Sector, Sector 2, HSR Layout, Bengaluru, Karnataka 560102, India",https://mavenrealty.in/,marketing@mavenrealty.in,Real Estate Agents in HSR Layout Bangalore,Connector
Search Homes India Private Limited - Real-estate Organization,090366 11811,"No 280 3rd Floor, Search Homes India Pvt Ltd, 5th Main Rd, 6th Sector, HSR Layout, Bengaluru, Karnataka 560102, India",https://www.searchhomesindia.com/,info@searchhomesindia.com,Real Estate Agents in HSR Layout Bangalore,Connector
Nexplace Realty,074066 66667,"#24, 14th Main Rd, opp. BDA Complex, Sector 4, HSR Layout, Bengaluru, Karnataka 560102, India",,,Real Estate Agents in HSR Layout Bangalore,Connector
Naidu properties,087626 41755,"1339,21st A Main, 11th Cross Rd, Vanganahalli, 1st Sector, HSR Layout, Bengaluru, Karnataka 560102, India",,,Real Estate Agents in HSR Layout Bangalore,Connector
Grah Realtors,080887 70518,"2724, 3rd Floor, 31th Main, 16th Cross Rd, PWD Quarters, 1st Sector, HSR Layout, Bengaluru, Karnataka 560102, India",https://grahrealtors.com/,jaideep.kumar@grahrealtors.com,Real Estate Agents in HSR Layout Bangalore,Connector
Future Realtor's,098867 56711,"343, 9th Main, 22nd Cross Rd, 7th Sector, HSR Layout, Bengaluru, Karnataka 560102, India",,,Real Estate Agents in HSR Layout Bangalore,Connector
Just Bricks Consulting,087926 93701,"552, 15th Cross, 16th Main Rd, Sector 4, HSR Layout, Bengaluru, Karnataka 560102, India",http://www.justbricks.in/,"sales@justbricks.in, sales@justbriks.in",Real Estate Agents in HSR Layout Bangalore,Connector
Skyway Realty,085480 51111,"49, 2nd Floor, AMR plaza, 18th Main Rd, Sector 3, HSR Layout, Bengaluru, Karnataka 560102, India",http://www.skywayrealty.in/,"sales@skywayrealty.in, %20sales@skywayrealty.in",Real Estate Agents in HSR Layout Bangalore,Connector
Golden Real Estate,098457 79531,"1143, 5th Main Rd, Sector 6, HSR Layout, Bengaluru, Karnataka 560102, India",,,Real Estate Agents in HSR Layout Bangalore,Connector
Fly Realty,098444 73355,"Ground Floor, Urban Vault, 19, 18th Cross Rd, Sector 6, HSR Layout, Bengaluru, Karnataka 560102, India",https://www.flyrealty.in/?utm_source=gmb,,Real Estate Agents in HSR Layout Bangalore,Connector
myneighbour.in Pvt.Ltd.,097409 27445,"254, ground floor 15th C' main, 19th Cross Rd, Sector 3, HSR Layout, Bengaluru, Karnataka 560102, India",,,Real Estate Brokers in HSR Layout Bangalore,Connector
Nayak Associates,090358 83333,"1716, 1st Floor , 27th Cross Road19th, Main, Road, Garden Layout, Sector 2, HSR Layout, Bengaluru, Karnataka 560102, India",,,Real Estate Brokers in HSR Layout Bangalore,Connector
Lakshmi Dheeraj Realty,099727 06109,"Flat no,103, 2nd floor, Shreyas Arcade, Bldg no, 1031, 24th Main Rd, 1st Sector, HSR Layout, Bengaluru, Karnataka 560102, India",,,Real Estate Brokers in HSR Layout Bangalore,Connector
Property Zone Estate Pvt Ltd,099866 77668,"1st floor, 22nd main, 199/1, Agara Village, 1st Sector, HSR Layout, Bengaluru, Karnataka 560102, India",https://www.propertyzonestate.com/,info@propertyzonestate.com,Property Dealers in HSR Layout Bangalore,Connector
Paramount Properties,098866 77468,"6/1, 24th Main, 25th A, Cross, Parangipalya Main Rd, Sector 2, HSR Layout, Bengaluru, Karnataka 560102, India",,,Property Dealers in HSR Layout Bangalore,Connector
Your Properties Management,097404 45221,"3rd Avenue, 241/1, 5th Main Rd, Teacher's Colony, Jakkasandra, 1st Block Koramangala, Koramangala, Bengaluru, Karnataka 560034, India",https://www.yourpropertiesmanagement.com/,,Property Dealers in HSR Layout Bangalore,Connector
Kumari Infra Homes Pvt Ltd,076760 88888,"2nd Floor, No 7/A, 19th Main Rd, Sector 3, HSR Layout, Bengaluru, Karnataka 560102, India",https://kumaribuilders.com/,,Real Estate Builders in HSR Layout Bangalore,Connector
Namma Space,099644 43366,"2456/A, 25th Main Rd, 1st Sector, HSR Layout, Bengaluru, Karnataka 560102, India",http://www.nammaspace.in/,,Real Estate Builders in HSR Layout Bangalore,Connector
Genurise Builders Pvt Ltd,080 4850 7166,"444, Grand, 3rd Floor, 16th Cross, 5th Main Rd, near Titan Eye Showroom, 6th Sector, HSR Layout, Bengaluru, Karnataka 560102, India",https://genurisebuilders.com/,projectinfo@genurisebuilders.com,Real Estate Builders in HSR Layout Bangalore,Connector
Oceanus Group - Real Estate Builders & Construction Company,099451 57780,"Oceanus Group No.1090/B, PN Plaza, 4th Floor, 18th Cross Rd, 3rd Sector, HSR Layout, Bengaluru, Karnataka 560102, India",http://www.oceanus.co.in/,"marketing@oceanus.co.in, info@oceanus.co.in",Real Estate Builders in HSR Layout Bangalore,Connector
Subha Builders and Developers,078160 00555,"4th Floor, No 758 & 759, 19th Main Rd, near Sai Baba Temple, 2nd Sector, Garden Layout, Sector 2, HSR Layout, Bengaluru, Karnataka 560102, India",https://www.subhabuilders.com/,"info@durgaprojects.in, info@subhabuilders.com",Real Estate Builders in HSR Layout Bangalore,Connector
NammaHome Infra& tech pvt Ltd|Best Home construction company in Bangalorel Architecture Design| Custom Interiors.,081053 37220,"2nd floor, 1192/1, 24th Main Rd, 2nd Sector, BDA Layout, HSR Layout, Bengaluru, Karnataka 560102, India",https://www.nammahome.co/,info@nammahome.co,Real Estate Builders in HSR Layout Bangalore,Connector
NBR Group,090350 97084,"168, 19th Main Rd, Sector 4, HSR Layout, Bengaluru, Karnataka 560102, India",https://www.nbrgroup.in/,"frontdesk@nbrprojects.com, frontdesk@nbrgroup.in, frontdesk@nbrgroup.in ",Real Estate Builders in HSR Layout Bangalore,Connector
ODION BUILDERS AND DEVELOPERS,080 2572 0202,"WJCW+J33, Agara Village, 1st Sector, HSR Layout, Bengaluru, Karnataka 560102, India",http://www.odionbuilders.com/,sales@odionbuilders.com,Real Estate Builders in HSR Layout Bangalore,Connector
Maa Homes,096061 20156,"No 758 & 759, 3rd Floor, 19th Main Rd, near Sai Baba Temple, 2nd Sector, Garden Layout, Sector 2, HSR Layout, Bengaluru, Karnataka 560102, India",http://www.maahomes.in/,info@maahomes.in,Real Estate Builders in HSR Layout Bangalore,Connector
M5 Mahendra Homes,076767 64466,"51, 12th Main Rd, Sector 6, HSR Layout, Bengaluru, Karnataka 560102, India",https://mahendrahomes.com/,,Real Estate Builders in HSR Layout Bangalore,Connector
Spandana Developers,063629 99543,"#2580,Spandana, 27th Main Road, 13th Cross Rd, 1st Sector, HSR Layout, Bengaluru, Karnataka 560102, India",,,Real Estate Builders in HSR Layout Bangalore,Connector
"SVB Developers | New Age Builders in Bangalore, with a 3-Decade Old Legacy",080502 92666,"249 , 1st Floor, 19th Main Rd, Sector 4, HSR Layout, Bengaluru, Karnataka 560102, India",http://svbdevelopers.com/,,Real Estate Builders in HSR Layout Bangalore,Connector
Sai Reniit Group,088809 56956,"4th floor, 1391/16/1, 19th Main, 17th Cross Rd, Sector 4, HSR Layout, Bengaluru, Karnataka 560102, India",https://www.saireniit.co.in/,"info@saireniit.co.in
, info@saireniit.co.in",Real Estate Builders in HSR Layout Bangalore,Connector
Aashrayaa Projects,080880 04499,"13th Cross Road, No.4, 9th Main Rd, Sector 6, HSR Layout, Bengaluru, Karnataka 560102, India",https://aashrayaaprojects.com/,,Real Estate Builders in HSR Layout Bangalore,Connector
Magnitude Square Realty pvt ltd,099724 23269,"2607, 27th Main Rd, Sector 5, 1st Sector, HSR Layout, Bengaluru, Karnataka 560102, India",,,Real Estate Builders in HSR Layout Bangalore,Connector
Hightower Constructions,063660 79333,"HUSTLEHUB Tech Park No, 1564, Revanna's building, 27th Main Rd, 2nd Sector, ITI Layout, 7th Sector, HSR Layout, Bengaluru, Karnataka 560102, India",http://hightowerconstructions.com/,,Construction Companies in HSR Layout Bangalore,Connector
Uniquebuildss construction & Interiors company in bangalore,096060 92193,"234, 9th Main Rd, Sector 6, HSR Layout, Bengaluru, Karnataka 560102, India",https://www.uniquebuildss.com/,,Construction Companies in HSR Layout Bangalore,Connector
JRN Constructions,099457 67453,"2763D, 22nd Main Rd, Agara Village, 1st Sector, HSR Layout, Bengaluru, Karnataka 560102, India",http://jrnconstructions.com/,"jrnconstructionss@gmail.com ,  jrnconstructionss@gmail.com , jrnconstructionss@gmail.com",Construction Companies in HSR Layout Bangalore,Connector
Dhesh Construction Pvt Ltd,063613 23197,"30/A 14th cross, 9th Main Rd, Sector 6, HSR Layout, Bengaluru, Karnataka 560102, India",https://www.dheshconstruction.com/,info@dheshconstruction.com,Construction Companies in HSR Layout Bangalore,Connector
Durga Projects & Infrastructure Pvt Ltd.,080 4120 3851,"3rd Floor, 1127/A, 17th Cross Rd, near BDA Complex, 7th Sector, HSR Layout, Bengaluru, Karnataka 560102, India",https://durgaprojects.in/,info@durgaprojects.in,Construction Companies in HSR Layout Bangalore,Connector
Buildryt | Home Construction Company,097759 49775,"BUILDRYT, 8th cross, 27th Main Rd, 1st Sector, HSR Layout, Bengaluru, Karnataka 560102, India",,,Construction Companies in HSR Layout Bangalore,Connector
Liam Constructions Pvt Ltd,099024 81030,"3rd floor, 1143, 6th Main Rd, 7th Sector, HSR Layout, Bengaluru, Karnataka 560102, India",http://www.liamconstructioncompany.com/,"info@liamconstructioncompany.com, -%20info@liamconstructioncompany.com",Construction Companies in HSR Layout Bangalore,Connector
R A K Construction,080 4110 1467,"R.A.K Chambers # 155, 11th Cross, RAK Chambers, K155, 17th Main Rd, Sector 4, HSR Layout, Bengaluru, Karnataka 560102, India",http://www.rakconstruction.in/,info@rakconstruction.in,Construction Companies in HSR Layout Bangalore,Connector
