Business Name,Phone Number,Address,Website,Emails,Search Phrase Used,Profile Category
TaxbyZero - Accountants & Tax Consultants,083281 14404,"Floor 1-A, Industrial site, off 17th F Cross Road, laksmipuram, Indiranagar, Bengaluru, Karnataka 560008, India",https://taxbyzero.com/,,Tax Consultants in Indiranagar Bangalore,Connector
Getsettax Consulting,086606 16357,"No.226, 1st Floor, 7th Cross, 5th Main Rd, Indira Nagar 1st Stage, Stage 1, Indiranagar, Bengaluru, Karnataka 560038, India",http://getsettax.com/,,Tax Consultants in Indiranagar Bangalore,Connector
Fiscal Flow - Finance and Tax Firm,081478 12917,"101, 2nd Cross Rd, New Baiyyappanahalli Extension, Indiranagar, Bengaluru, Karnataka 560038, India",http://fiscalflow.in/,example@mysite.com,Tax Consultants in Indiranagar Bangalore,Connector
Ankitha Taxation & Accounting Services,080731 48730,"7/2,KVD Plazaa,Ground Floor,Old Madras Road,100 Feet Road,Dead End Indira Nagar, Kadiranapalya, Sarvagnanagar, Bengaluru, Karnataka 560038, India",https://ankithataxationandaccountingservices.com/,,Tax Consultants in Indiranagar Bangalore,Connector
"NS & Co, Auditors & Tax Consultants",099005 04214,"No. 1, Second Floor, Double Road, off Chinmaya Mission Hospital Road, Opp: HDFC Bank, Stage 2, Hoysala Nagar, Indiranagar, Bengaluru, Karnataka 560038, India",,,Tax Consultants in Indiranagar Bangalore,Connector
Accotax Advisors Private Limited,080 2521 3322,"2nd Floor, No. 843, 5th Main Rd, Indira Nagar 1st Stage, Stage 1, Indiranagar, Bengaluru, Karnataka 560038, India",,,Tax Consultants in Indiranagar Bangalore,Connector
Tax 2 Solutions,080 4374 5620,"1st Floor, 3290, 12th Main Rd, HAL 2nd Stage, Doopanahalli, Indiranagar, Bengaluru, Karnataka 560008, India",,,Tax Consultants in Indiranagar Bangalore,Connector
"Accounting, Tax and GST Services-S3 Solutions Pvt Ltd",076768 87733,"1/1, 7th Main Rd, Indira Nagar II Stage, laksmipuram, Indiranagar, Bengaluru, Karnataka 560008, India",http://www.s3solutions.in/,,Tax Consultants in Indiranagar Bangalore,Connector
CLG Financial Services Pvt Ltd,087468 47250,"1234,2nd Floor 17F Cross Road, Chinmaya Mission Hospital Rd, laksmipuram, Indiranagar, Bengaluru, Karnataka 560008, India",http://www.clgfinancialservices.com/,info@clgfinanceservices.com,Financial Advisors in Indiranagar Bangalore,Connector
Zvest Financial Services LLP,098866 84167,"3rd Floor, Sunrise Chambers, E307, Ulsoor Rd, Yellappa Garden, Yellappa Chetty Layout, Sivanchetti Gardens, Bengaluru, Karnataka 560008, India",http://www.zvest.in/,,Financial Advisors in Indiranagar Bangalore,Connector
IFS - Investors Fund Services,080 4851 6571,"#539, 3rd floor, Metro Station, Chinmaya Mission Hospital Rd, near Indiranagar, Stage 1, Indiranagar, Bengaluru, Karnataka 560038, India",http://www.investorsfundservices.com/,,Financial Advisors in Indiranagar Bangalore,Connector
Armstrong Capital & Financial Services Pvt Ltd,093803 58305,"5th Floor, A1 Tower, Corporate block, Golden Enclave Apartment, HAL Old Airport Rd, Murugeshpalya, Bengaluru, Karnataka 560017, India",http://www.armstrong-cap.com/,reachus@armstrong-cap.com,Financial Advisors in Indiranagar Bangalore,Connector
Geojit Financial Services Ltd,090725 30278,"Metro Station, No 824, 10th A Main Rd, near Indiranagar, Stage 1, Indiranagar, Bengaluru, Karnataka 560038, India",https://branch.geojit.com/geojit-financial-services-ltd-stock-broker-indiranagar-bengaluru-287107/Home,"frazertown@geojit.com, Majestic_aaw@geojit.com, hsrlayout_abh@geojit.com, banaswadi_aqg@geojit.com, indiranagar@geojit.com, indu_k@geojit.com, compliance@geojit.com, customercare@geojit.com, marathhalli@geojit.com, bangalore@geojit.com, Halairportroad_abr@geojit.com, jayamahal_aqi@geojit.com, Kammanhalli@geojit.com, Koramangala@geojit.com, Rtnagar@geojit.com, grievances@geojit.com",Financial Advisors in Indiranagar Bangalore,Connector
BetterPlan Financial Services,099014 49707,"RKR building, Kaggadasapura Main Rd, Kaggadasapura, Bengaluru, Karnataka 560093, India",,,Financial Advisors in Indiranagar Bangalore,Connector
Y. Sridhar,098450 46195,"#744, 1st Floor, Shri Krishna Temple Rd, Indira Nagar 1st Stage, 1st Stage, Indiranagar, Bengaluru, Karnataka 560038, India",http://www.ysridhar.com/,"ysridhar744@gmail.com, saffollya.inv@gmail.com, manoj.yenni.744@gmail.com",Financial Advisors in Indiranagar Bangalore,Connector
Banyan Tree Advisors,080 4642 8500,"1155, 12th Main Rd, Hal, HAL 2nd Stage, Indiranagar, Bengaluru, Karnataka 560008, India",http://banyantreeadvisors.com/,,Financial Advisors in Indiranagar Bangalore,Connector
UNITED FINANCIAL SERVICES,098455 57688,"6, 7th Main Rd, Indira Nagar II Stage, Hoysala Nagar, Indiranagar, Bengaluru, Karnataka 560008, India",http://www.unitedfinserve.com/,"contact@unitedwealthadvisors.in, mail@unitedfinserve.com, contact@unitedwealthadvisors.com",Financial Advisors in Indiranagar Bangalore,Connector
Geojit Private Wealth,073064 28782,"1st Flr, 22, Chinmaya Mission Hospital Rd, opposite Metro Pillar No 80, 2nd Stage, Indira Nagar II Stage, Hoysala Nagar, Indiranagar, Bengaluru, Karnataka 560038, India",https://branch.geojit.com/geojit-private-wealth-stock-broker-indira-nagar-bengaluru-501058/Home,"frazertown@geojit.com, Majestic_aaw@geojit.com, banaswadi_aqg@geojit.com, indiranagar@geojit.com, indu_k@geojit.com, compliance@geojit.com, customercare@geojit.com, marathhalli@geojit.com, bangalore@geojit.com, Halairportroad_abr@geojit.com, jayamahal_aqi@geojit.com, malleswaram@geojit.com, Kammanhalli@geojit.com, Koramangala@geojit.com, Rtnagar@geojit.com, grievances@geojit.com",Financial Advisors in Indiranagar Bangalore,Connector
Algates Insurance,095970 00365,"2nd Floor, 777/P, 13th Main Rd, HAL 2nd Stage, Doopanahalli, Indiranagar, Bengaluru, Karnataka 560008, India",https://algatesinsurance.in/,,Insurance Agents in Indiranagar Bangalore,Connector
Aditya Birla Sun Life Insurance,1800 270 7000,"No 777F, 2nd Floor, 100 Feet Rd, opposite New Horizon Public School, HAL 2nd Stage, Indiranagar, Bengaluru, Karnataka 560008, India",https://lifeinsurance.adityabirlacapital.com/branch-locator/karnataka/bengaluru/indiranagar/,"absli.nrihelpdesk@adityabirlacapital.com, u003eabsli.nrihelpdesk@adityabirlacapital.com, claims.lifeinsurance@adityabirlacapital.com, u003eclaims.lifeinsurance@adityabirlacapital.com, abc@gmail.com, u003ecare.lifeinsurance@adityabirlacapital.com, care.lifeinsurance@adityabirlacapital.com",Insurance Agents in Indiranagar Bangalore,Connector
Edelweiss Life Insurance,1800 212 1212,"3rd Floor, No 483, Chinmaya Mission Hospital Rd, above Dr. Batra's Clinic, 1st Stage, Binnamangala, Stage 1, Indiranagar, Bengaluru, Karnataka 560038, India",https://www.edelweisslife.in/,,Insurance Agents in Indiranagar Bangalore,Connector
United India and Star Health Insurance Agency Bangalore,099867 23132,"No 251, 4th cross, 4th Main Rd, Hal, HAL 3rd Stage, New Tippasandra, Bengaluru, Karnataka 560075, India",,,Insurance Agents in Indiranagar Bangalore,Connector
Kotak Life Insurance,086559 92617,"2013, 100 Feet Rd, HAL 2nd Stage, Indiranagar, Bengaluru, Karnataka 560038, India",https://www.kotaklife.com/,kli.riskcontrol@kotak.com,Insurance Agents in Indiranagar Bangalore,Connector
Pramerica Life Insurance Limited,092892 07070,"493, 2nd floor, Anjali plaza, Chinmaya Mission Hospital Rd, Indira Nagar 1st Stage, Stage 1, Indiranagar, Bengaluru, Karnataka 560038, India",https://pramericalife.in/,,Insurance Agents in Indiranagar Bangalore,Connector
United India Insurance Company Limited,080 2221 0847,"3rd Flour, Indira Nagar 1st Stage, Stage 1, Indiranagar, Bengaluru, Karnataka 560038, India",,,Insurance Agents in Indiranagar Bangalore,Connector
HDFC ERGO Insurance Agent: G Deepa,079 4276 1986,"House No 797 12th Main Road, 1st Cross Rd, HAL 2nd Stage, Appareddipalya, Indiranagar, Bengaluru, Karnataka 560008, India",https://agent.hdfcergo.com/hdfc-ergo-insurance-agent-g-deepa-insurance-broker-indiranagar-bengaluru-371650/Home?utm_source=locator&utm_medium=googleplaces,"seemasaajeev@gmail.com, jmt2311@gmail.com, smrd35@yahoo.com, manjaythakur366@gmail.com, Kvcvenkat@Yahoo.Co.In, lordsnelson@yahoo.com, rare76@gmail.com, chandsr05@gmail.com, bgykumar@gmail.com, thirent@gmail.com, venkat.aisats@gmail.com, somanathlic@gmail.com, akshaya.advisory@gmail.com",Insurance Agents in Indiranagar Bangalore,Connector
