Business Name,Phone Number,Address,Website,Emails,Search Phrase Used,Profile Category
Varma Raja & Associates,094805 02566,"896,7th Main, 4th Cross, near Bescom Officers Colony, HAL 2nd Stage, Appareddipalya, Indiranagar, Bengaluru, Karnataka 560008, India",http://www.varmaraja.com/,info@varmaraja.com,Auditing Firms in Indiranagar Bangalore,Connector
GST & Income Tax Return Filing in Bangalore - Koffice,094801 79854,"1st Floor, in GST Office, BMTC Bus Stand, No.2, HAL Old Airport Rd, Domlur I Stage, Stage 2, Domlur, Bengaluru, Karnataka 560071, India",,,GST Consultants in Indiranagar Bangalore,Connector
"EasyBackOffice - Accounting, GST Filing, Income Tax, Payroll",098805 34216,"Metro Pillar #81, Land Mark:, 24, Chinmaya Mission Hospital Rd, Indira Nagar 1st Stage, Hoysala Nagar, Indiranagar, Bengaluru, Karnataka 560008, India",http://easybackoffice.in/,,GST Consultants in Indiranagar Bangalore,Connector
Bulwark Financial Services LLP,098459 49779,"3488, 14th Main Rd, HAL 2nd Stage, Indiranagar, Bengaluru, Karnataka 560008, India",http://www.bulwarkfs.com/,,Wealth Management in Indiranagar Bangalore,Connector
EldersWealth,080 4709 6394,"28/A, 3rd Main Rd, RMS Colony, AECS Layout, Sanjayanagara, Bengaluru, Karnataka 560094, India",https://www.elderswealth.com/,,Wealth Management in Indiranagar Bangalore,Connector
2i Wealth,088385 94267,"91, Spring Board, George Thangaiah Complex, 13, 80 Feet Rd, Michealpalya 1st Stage, Indira Nagar 1st Stage, H Colony, Indiranagar, Bengaluru, Karnataka 560038, India",http://www.2iwealth.in/,"info@indiantypefoundry.com, filler@godaddy.com",Wealth Management in Indiranagar Bangalore,Connector
FinMen Advisors and Consultants Pvt Ltd,098867 05427,"#514, 5th Floor, A Block, Carlton Towers, HAL Old Airport Rd, HAL 2nd Stage, Kodihalli, Bengaluru, Karnataka 560008, India",https://finmen.in/,"marketing@finmen.in, info@finmen.in",Banking Consultants in Indiranagar Bangalore,Connector
BygC Solutions Pvt. Ltd. - Bangalore,089047 73337,"Souravya, Metro Station Indira Nagar, 10th A Main Rd, near Indiranagar, Indira Nagar 1st Stage, Stage 1, Indiranagar, Bengaluru, Karnataka 560038, India",https://bygc.co/,"%20info@bygc.co, info@bygc.co",Banking Consultants in Indiranagar Bangalore,Connector
Kinara Capital Corporate Office,1800 103 2683,"660/1, 100 Feet Rd, 1st Stage, Stage 1, Indiranagar, Bengaluru, Karnataka 560038, India",https://www.kinaracapital.com/,,Banking Consultants in Indiranagar Bangalore,Connector
CREDITTECHNO,093410 26073,"3rd Floor Cabin #18, HIProfiles Business Centre, 1/A, Church St, opp. to Starbucks caffee, Shanthala Nagar, Ashok Nagar, Bengaluru, Karnataka 560001, India",http://www.credittechno.com/,,Banking Consultants in Indiranagar Bangalore,Connector
Virtuoso partners,099724 44633,"Virtuoso Partners, 505/1, 3rd Floor, Above Sattva Clinic, 2nd Cross, Chinmaya Mission Hospital Rd, 1st Stage, Indira Nagar 1st Stage, Stage 1, Indiranagar, Bengaluru, Karnataka 560038, India",https://www.vphl.in/,piyush@vphl.in,Banking Consultants in Indiranagar Bangalore,Connector
"Manoj Kumar D & Associates - Chartered Accountants, Bangalore",073533 30066,"422, 8th Main Rd, KHB Colony, Koramangala 4-B Block, 4th Block, Koramangala, Bengaluru, Karnataka 560034, India",https://camanojkumar.com/,manoj@camanojkumar.com,Chartered Accountants in Koramangala Bangalore,Connector
BSRS & Associates Chartered Accountants,077600 97288,"No.5, 2nd Floor, Basavanna, Ganapathi Temple Rd, Koramangala 8th Block, Koramangala, Bengaluru, Karnataka 560095, India",https://bsrsassociates.com/,"admin@bsrsassociates.com, info@bsrsassociates.com",Chartered Accountants in Koramangala Bangalore,Connector
"Anil & Aditya, Chartered Accountants & DGFT Consultants, Koramangala, Bangalore",091138 04663,"No. 7/1, Sai Sparsh, 1st Cross, 100 feet, 100 Feet Rd, above cycle world, Chandra Reddy Layout, Srinivagilu Extension, Koramangala, Bengaluru, Karnataka 560047, India",https://anilandaditya.com/,,Chartered Accountants in Koramangala Bangalore,Connector
CA Riya Thawani & Company,070006 75347,"First Floor, Near DTDC Courier, above Sanjay medicals 2nd cross, Hosur Rd, Nanjappa Layout, Adugodi, Bengaluru, Karnataka 560030, India",,,Chartered Accountants in Koramangala Bangalore,Connector
Ruchi Agrawal & Co,089719 20072,"1st Floor, NMR Enclave, No 7/22, Ejipura Main Rd, Ejipura, Bengaluru, Karnataka 560047, India",,,Chartered Accountants in Koramangala Bangalore,Connector
Mohan & Chandrasekhar Chartered Accountants,093444 78863,"No 224, Ground Floor, 4th Cross, 5th Block, KHB Colony, Koramangala Industrial Layout, Koramangala, Bengaluru, Karnataka 560095, India",http://www.mohansekhar.in/,,Chartered Accountants in Koramangala Bangalore,Connector
"D K T S & Co., Chartered Accountants",090354 14549,"1st Avenue, Ground floor, Skanda Krupa, 1st Main Rd, Teacher's Colony, Santhosapuram, 1st Block Koramangala, HSR Layout, Bengaluru, Karnataka 560034, India",https://www.dktsco.com/,,Chartered Accountants in Koramangala Bangalore,Connector
K B Nambiar & Associates,099002 06720,"P N, S School Annexe, CA 14, 20th Main Rd, adjacent to India Post, KHB Colony, 6th Block, Koramangala, Bengaluru, Karnataka 560095, India",http://www.kbnambiar.com/,admin@kbnambiar.com,Chartered Accountants in Koramangala Bangalore,Connector
ATUL CHUTANI & CO. CA near me | Accounting Service | Audit,088007 74230,"67, 2ND FLOOR, 4TH BLOCK, 9TH MAIN ROAD, 2nd Cross Rd, 4th Block, Koramangala, Bengaluru, Karnataka 560034, India",,,Chartered Accountants in Koramangala Bangalore,Connector
M Daga & Co. Chartered Accountants,080 4152 0262,"WJR9+8PV, Koramangala 8th Block, Koramangala, Bengaluru, Karnataka 560095, India",,,Chartered Accountants in Koramangala Bangalore,Connector
"Salsabeel Ahmed & Co., Chartered Accountants in Bangalore",098801 06346,"Salsabeel Ahmed & Co Ataura Business Centre, 99/D, 2nd B Cross Rd, KHB Colony, 5th Block, Koramangala, Bengaluru, Karnataka 560095, India",http://www.salsabeelahmedandco.com/,,Chartered Accountants in Koramangala Bangalore,Connector
PASHA & CO,095388 38888,"443 1st Floor, KHB Colony, 7th Block, Koramangala, Bengaluru, Karnataka 560095, India",http://www.booksofaccounts.com/,,Chartered Accountants in Koramangala Bangalore,Connector
"J JAISON & CO ( JJC) -CHARTERED ACCOUNTANTS—BTM , BANGALORE",081379 21321,"Building No503, 3rd Floor, opposite to Our Lady Fathima School, Old Madiwala, Chikka Madivala, 1st Stage, BTM 1st Stage, Bengaluru, Karnataka 560068, India",https://www.jjcaind.com/,"jjcekm@gmail.com, cajaison.jjc@gmail.com, info.jjcekm@gmail.com",Chartered Accountants in Koramangala Bangalore,Connector
Shweta Saboo & Co.,095389 82505,"2nd Floor, Ooty Chocolates building, 8th Main Rd, KHB Colony, Koramangala 4-B Block, 5th Block, Koramangala, Bengaluru, Karnataka 560034, India",,,Chartered Accountants in Koramangala Bangalore,Connector
Jain Ankush k & Associates,097319 99901,"2nd floor, ooty chocolates building, 8th Main Rd, KHB Colony, 4th Block, Koramangala, Bengaluru, Karnataka 560034, India",,,Chartered Accountants in Koramangala Bangalore,Connector
Zruti Consultants,097381 23263,"75, 3rd Cross Rd, behind Kendriya Sadan, Sidharata Colony, Santhosapuram, 2nd Block, Koramangala, Bengaluru, Karnataka 560068, India",http://zruti.in/,info@zruti.in,Tax Consultants in Koramangala Bangalore,Connector
HappyTax Consulting Private Limited,081238 05254,"L V Complex.58, 4th floor, No. 58/1, Land Mark: Sangeetha Mobiles Building, KHB Colony, 7th Block, Koramangala, Bengaluru, Karnataka 560095, India",https://wa.me/message/K5KW6NTRZESIN1,,Tax Consultants in Koramangala Bangalore,Connector
EvoTax,090196 35151,"2nd floor, 11, 80 Feet Rd, 1st Block Koramangala, Koramangala, Bengaluru, Karnataka 560034, India",https://evotaxes.com/,,Tax Consultants in Koramangala Bangalore,Connector
InstaFiling,076790 91881,"4th Block, 472/3, AVS Layout, Koramangala, Bengaluru, Karnataka 560034, India",https://www.instafiling.com/,,Tax Consultants in Koramangala Bangalore,Connector
"Aghanya Tax Consultants - Chartered Accountants, Gst, Income tax filing",078998 23959,"441/A 1st A Cross, 12th Main Rd, 4th Block, Koramangala, Bengaluru, Karnataka 560034, India",https://aghanyaconsultancy.com/?utm_source=google_profile&utm_campaign=localo&utm_medium=mainlink,aghanyataxconsultants@gmail.com,Tax Consultants in Koramangala Bangalore,Connector
"filingbee - Company Registration , GST Registration , GST Return filing , Trademark Registration in Bangalore I Auditors",063995 79999,"5th floor, Kay Arr Ivy Building, 692, 6th A Cross Rd, near BDA Complex, 3rd Block, Koramangala 3 Block, Koramangala, Bengaluru, Karnataka 560034, India",http://www.filingbee.in/,,Tax Consultants in Koramangala Bangalore,Connector
Accovet Ltd,095677 81143,"Un 323, Third Floor, Raheja Arcade, 1/168, 5th Block, Koramangala Industrial Layout, Koramangala, Bengaluru, Karnataka 560095, India",https://www.accovet.com/,info@accovet.com,Tax Consultants in Koramangala Bangalore,Connector
Income Tax Department - Koramangala,1800 180 1961,"BMTC Building, 80 Feet Road, 6th Block, Koramangala, National Games Village Complex, 6th Block, Koramangala, Bengaluru, Karnataka 560095, India",http://www.incometaxbengaluru.in/,,Tax Consultants in Koramangala Bangalore,Connector
Saakar Financial Services,080 4130 9761,"5 2nd Floor, 80 Feet Rd, 1st Block Koramangala, Koramangala, Bengaluru, Karnataka 560034, India",http://saakarfinserv.com/,ajayruia@saakarfinserv.com,Financial Advisors in Koramangala Bangalore,Connector
Purnartha Investment Advisers Private Limited | Portfolio Management Services (PMS) | Investment Advisory,020 6901 7100,"580, 3rd Floor, Aswan Plaza, 20th Main Rd, Koramangala 8th Block, Koramangala, Bengaluru, Karnataka 560095, India",https://www.purnartha.com/,,Financial Advisors in Koramangala Bangalore,Connector
S.R.Financial Solutions,098450 85872,"153, 60 Feet Rd, KHB Block Koramangala, 5th Block, Koramangala, Bengaluru, Karnataka 560095, India",,,Financial Advisors in Koramangala Bangalore,Connector
PMF Advisors LLP,098602 23694,"Unit No 246, 2nd Floor, Raheja Arcade, 5th Block, Adugodi, Bengaluru, Karnataka 560095, India",https://pmfadvisors.com/,,Financial Advisors in Koramangala Bangalore,Connector
Wealthy Monk Finserv,077609 85005,"Wework - Koramangala, Prestige Atlanta, 80 Feet Rd, Koramangala 1A Block, Koramangala 3 Block, Koramangala, Bengaluru, Karnataka 560034, India",https://www.wealthymonk.in/,"Info@test.com, contact@wealthymonk.in",Financial Advisors in Koramangala Bangalore,Connector
Geojit Financial Services Ltd,073381 91374,"No146, Maanu, 5th Cross Rd, KHB Colony, 5th Block, Koramangala, Bengaluru, Karnataka 560095, India",https://branch.geojit.com/geojit-financial-services-ltd-stock-broker-koramangala-bengaluru-287283/Home,"Majestic_aaw@geojit.com, Banashankari_ih@geojit.com, Banashankaribda_abg@geojit.com, indiranagar@geojit.com, indu_k@geojit.com, compliance@geojit.com, customercare@geojit.com, marathhalli@geojit.com, Btm@geojit.com, bangalore@geojit.com, Halairportroad_abr@geojit.com, Koramangala@geojit.com, hsrlayout_abh@geojit.com, jayanagar@geojit.com, Jbjayanagar@geojit.com, grievances@geojit.com",Financial Advisors in Koramangala Bangalore,Connector
Cerebral Investments & Fiduciary Services,077950 00499,"1st Floor, Grandhe Tranquil, 715/B, 17th C Main Rd, 6th Block, Koramangala, Bengaluru, Karnataka 560095, India",https://cerebraladvisors.com/,,Financial Advisors in Koramangala Bangalore,Connector
FinGurus,099869 96350,"SJR Koramangala, 1st Floor, Sony World Signal, Plot 36, 100 Feet Rd, Venkappa Garden, Koramangala, Bengaluru, Karnataka 560095, India",http://fingurus.com/,marketing@fingurus.com,Financial Advisors in Koramangala Bangalore,Connector
Credvent Advisory Private Limited,095135 20028,"3rd Floor, 6th, Block, 71-72, Jyoti Nivas College Rd, 5th Block, Koramangala, Bengaluru, Karnataka 560095, India",https://www.credvent.com/,info@credvent.com,Financial Advisors in Koramangala Bangalore,Connector
EARN MONEY AND TIME,070192 46661,"+917019246661, 24, 5th Cross Rd, KHB Colony, 5th Block, Koramangala, Bengaluru, Karnataka 560095, India",,,Financial Advisors in Koramangala Bangalore,Connector
SriNivesh Advisors,089797 00881,"319, 18th G Main Rd, 6th Block, Koramangala, Bengaluru, Karnataka 560095, India",https://srinivesh.in/,info@srinivesh.in,Financial Advisors in Koramangala Bangalore,Connector
Digit Insurance,1800 258 5956,"Atlantis, 95, 4th B Cross Road, Koramangala Industrial Layout, 5th Block, KHB Colony, 5th Block, Koramangala, Bengaluru, Karnataka 560095, India",https://www.godigit.com/?utm_source=gbl&utm_medium=bengaluru,hello@godigit.com,Insurance Agents in Koramangala Bangalore,Connector
SBI Life Insurance Co Ltd,080 2550 7866,"4th Floor, Srinivasa Aracade, 5, near Hosur Road, Krishna Nagar Area, Koramangala, Bengaluru, Karnataka 560030, India",https://branches.sbilife.co.in/sbi-life-insurance-co-ltd-insurance-company-koramangala-bengaluru-201922/Home,"Punith.Reddy@Sbilife.Co.In, info@sbilife.co.in",Insurance Agents in Koramangala Bangalore,Connector
Axis Max Life Insurance,098218 53935,"Max Life Insurance Co. Ltd, 1st Floor, Sri Venkateshwara Complex, 914, 80 Feet Rd, 6th Block, Koramangala, Bengaluru, Karnataka 560095, India",https://www.axismaxlife.com/branches/karnataka/bengaluru/sri-venkateshwara-complex-koramangala-bangalore,"u003eservice.helpdesk@axismaxlife.com, service.helpdesk@axismaxlife.com, u003enri.helpdesk@axismaxlife.com, online@axismaxlife.com",Insurance Agents in Koramangala Bangalore,Connector
Instabima Insurance Web Aggregator Pvt Ltd.,098851 46555,"Indiqube-ZIP, Plot, 8, 7th A Main Rd, 3rd Block, Koramangala 1A Block, Koramangala 3 Block, Koramangala, Bengaluru, Karnataka 560034, India",https://www.instabima.com/,hello@instabima.com,Insurance Agents in Koramangala Bangalore,Connector
National Insurance,080 2563 3761,"18th Main, opposite to Bank Of Baroda, 6th Block, Koramangala, Bengaluru, Karnataka 560034, India",,,Insurance Agents in Koramangala Bangalore,Connector
LIC AGENT IN KORAMANGALA,098442 53450,"353, 7th Main Rd, Vivek Nagar, Bengaluru, Karnataka 560047, India",https://licindia.in/,,Insurance Agents in Koramangala Bangalore,Connector
HDFC Life Insurance,091674 49305,"No 1024, 2nd Floor 7th Main, 80 Feet Rd, 1st Block Koramangala, Koramangala, Bengaluru, Karnataka 560034, India",https://branch.hdfclife.com/hdfc-life-insurance-koramangala-insurance-company-koramangala-bengaluru-95965/Home,buyonline@hdfclife.in,Insurance Agents in Koramangala Bangalore,Connector
Digit Life Insurance,099601 26126,"Atlantis, 95, 4th B Cross Road, Koramangala Industrial Layout, WJM7+JXQ, KHB Colony, 5th Block, Koramangala, Bengaluru, Karnataka 560095, India",https://www.godigit.com/life?utm_source=gbl&utm_medium=bengaluru,life@godigit.com,Insurance Agents in Koramangala Bangalore,Connector
United India insurance company Advisor,099029 23069,"4th block, 227, 15th Main Rd, opp. chaitanya pu college, 4th Block, Koramangala, Bengaluru, Karnataka 560034, India",,,Insurance Agents in Koramangala Bangalore,Connector
Niva Bupa Health Insurance Bangalore,1860 500 8888,"First Floor, Vaishnavi Silicon Terrace, 30/1, near Hosur Road, Audugodi Police Quarters, Koramangala, Bengaluru, Karnataka 560095, India",http://www.nivabupa.com/,,Insurance Agents in Koramangala Bangalore,Connector
ICICI Prudential Life Insurance Company Limited,1800 2660,"99, ARD Complex, 99, 5th Cross Rd, near Apollo Cradle Hospital, KHB Colony, 6th Block, Koramangala, Bengaluru, Karnataka 560095, India",http://www.iciciprulife.com/,"Signature-pension-banner-Tab-@2x.webp, Banner-06-mob-@2x.webp, iPS-banner-Mobile-@2x.webp, Desktop-@2x.webp, claimsupport@iciciprulife.com, iPS-banner-Desktop-@2x.webp, Signature%20pension%20banner%20Desktop-@2x.webp, Banner-06-desktop-@2x.webp, Signature-pension-banner-Mobile-@2x.webp, Banner-03-desktop-@2x.webp, Banner-03-mob-@2x.webp",Insurance Agents in Koramangala Bangalore,Connector
HDFC ERGO Insurance Agent: R Umaprakash Rao,079 4275 9658,"Block No 8, No 844, 20th B Main Road, Koramangala 3 Block, Koramangala, Bengaluru, Karnataka 560034, India",https://agent.hdfcergo.com/hdfc-ergo-insurance-agent-r-umaprakash-rao-insurance-broker-koramangala-bengaluru-426900/Home?utm_source=locator&utm_medium=googleplaces,"prakashbc23@gmail.com, mohankumar@kione.in, ksripath@rediffmail.com, badaljyoti1982@gmail.com, amit7tata007@gmail.com, smaalan@gmail.com, umaprakash123@gmail.com, VIN9640RAY@GMAIL.COM, arulashok813@gmail.com, Aakashverma.Ansh@Gmail.Com, kumarappa.k18@gmail.com, themstream91@gmail.com, sanithomas2011@gmail.com",Insurance Agents in Koramangala Bangalore,Connector
Anthra Real Estate Agency,098451 05286,"#113, 6th Cross Rd, 6th Block, Koramangala, Bengaluru, Karnataka 560095, India",,,Real Estate Agents in Koramangala Bangalore,Connector
J. K. Real Estate,099803 26806,"WJP7+MF9, 7th Block, Koramangala, Bengaluru, Karnataka 560095, India",,,Real Estate Agents in Koramangala Bangalore,Connector
S.Z Real Estate Consultant,098450 18663,"S 215, 12th Main Rd, 4th Block, Koramangala, Bengaluru, Karnataka 560034, India",,,Real Estate Agents in Koramangala Bangalore,Connector
M S Properties By Yogesh T,096865 27503,"b, 79, 9th Main Rd, 4th Block, Koramangala, Bengaluru, Karnataka 560034, India",,,Real Estate Agents in Koramangala Bangalore,Connector
S.R Real Estate,098453 83212,"635, Adugodi Main Rd, Koramangala 8th Block, Koramangala, Bengaluru, Karnataka 560095, India",,,Real Estate Agents in Koramangala Bangalore,Connector
Koramangala Real Estate,098458 55663,"Shop No. 10, BDA Complex, 100 Feet Rd, Koramangala 3 Block, Koramangala, Bengaluru, Karnataka 560034, India",,,Real Estate Agents in Koramangala Bangalore,Connector
Rsquare reality- best realestate consultant in bangalore,077960 05004,"1st C Main, Behind Startbucks, Extension, 7th Block, Koramangala, Bengaluru, Karnataka 560095, India",http://www.rsquarereality.com/,,Real Estate Agents in Koramangala Bangalore,Connector
Settler Real Estate Consultants,080 4124 5141,"Raheja Arcade, Koramangala Industrial Layout, Adugodi, Bengaluru, Karnataka 560095, India",,,Real Estate Agents in Koramangala Bangalore,Connector
PropertyAngel | Property Management Services,074064 84455,"570/571, 16th A Main Rd, 3rd Block, Santhosapuram, Koramangala 3 Block, Koramangala, Bengaluru, Karnataka 560034, India",http://propertyangel.in/,,Real Estate Agents in Koramangala Bangalore,Connector
Propsoch – Real Estate Advisory | Buy Home in Bangalore,080503 00319,"2nd floor, Nomad Managed Spaces, 3rd Block, Santhosapuram, Koramangala 3 Block, Koramangala, Bengaluru, Karnataka 560034, India",https://www.propsoch.com/,club@propsoch.com,Real Estate Agents in Koramangala Bangalore,Connector
Vishwanath Real Estate,094482 39248,"6th Cross Rd, 6th Block, Koramangala, Bengaluru, Karnataka 560095, India",,,Real Estate Agents in Koramangala Bangalore,Connector
EasyFind Property Solutions,091483 38801,"A Block, Prestige Atlanta, 1, 80 Feet Rd, 3rd Block, Koramangala 8th Block, Koramangala, Bengaluru, Karnataka 560034, India",,,Real Estate Agents in Koramangala Bangalore,Connector
Thavarool Real Estate,063629 37140,"5th Floor, NA Chambers, 3j 3rd Cross, 7th C Main Rd, 3rd Block, Koramangala 1A Block, Koramangala 3 Block, Koramangala, Bengaluru, Karnataka 560034, India",https://thavaroolrealestate.in/,,Real Estate Agents in Koramangala Bangalore,Connector
Fortune Real Estate Consultancy,098445 70856,"No.38, AVS Compound, 80 Feet Rd, 4th Block, Koramangala, Bengaluru, Karnataka 560034, India",,,Real Estate Agents in Koramangala Bangalore,Connector
Fairdeal Estate Agency (Regd),080 2553 0274,"College, 127/2, Mig, near Jyoti Nivas, KHB Colony, 5th Block, Koramangala, Bengaluru, Karnataka 560095, India",http://www.facebook.com/fairdealestateagency,,Real Estate Agents in Koramangala Bangalore,Connector
Vishnu Realtors,099803 01374,"61/2, 7th Cross, 6th Block, Kathalipalaya, Koramangala Layout, KHB Colony, 6th Block, Koramangala, Bengaluru, Karnataka 560095, India",,,Real Estate Agents in Koramangala Bangalore,Connector
Premier Real Estate Services,084477 86500,"No.645, 3rd floor, 12th Cross, 27th Main Rd, 1st Sector, HSR Layout, Bengaluru, Karnataka 560102, India",http://premier-realestate.in/,,Real Estate Agents in Koramangala Bangalore,Connector
GoldFinch Realty,098861 61049,"1 4th cross, 3rd Main Rd, Ayyappa Temple Block, Vannarpet, Yerappa Garden, Neelasandra, Bengaluru, Karnataka 560047, India",,,Real Estate Brokers in Koramangala Bangalore,Connector
Vakil Housing,080 4119 3293,"78, Jyoti Nivas College Rd, Koramangala Industrial Layout, Koramangala, Bengaluru, Karnataka 560095, India",http://www.vakilhousing.com/,user@domain.com,Real Estate Builders in Koramangala Bangalore,Connector
SHREE REAL ESTATE KORMANGALA,098458 44417,"57, 1st A Main Rd, Koramangala 7 Block, 7th Block, Koramangala, Bengaluru, Karnataka 560095, India",,,Real Estate Builders in Koramangala Bangalore,Connector
White Projects,080 4666 5555,"House of White, #75, Hosur Road, 5th Block, Industrial Area, 5th Block, Koramangala, Bengaluru, Karnataka 560095, India",https://proppulse.ai/bangalore/pre-launch-projects/,info@proppulse.ai,Real Estate Builders in Koramangala Bangalore,Connector
SIGNATURE DWELLINGS PVT. LTD,074110 02288,"3rd Floor, 21 & 22, 1st Main Rd, 1st Block Koramangala, Koramangala, Bengaluru, Karnataka 560034, India",https://www.signaturedwellings.in/,info@signaturedwellings.in,Real Estate Builders in Koramangala Bangalore,Connector
CoEvolve Estates,080 2550 2550,"2nd Floor, 476, 80 Feet Rd, 6th Block, Koramangala, Bengaluru, Karnataka 560095, India",http://www.coevolvegroup.com/,,Real Estate Builders in Koramangala Bangalore,Connector
MFAR Constructions Private Limited,080 4110 2170,"AVS Compound, 8 & 8A, 80 Feet Rd, 4th Block, Koramangala, Bengaluru, Karnataka 560034, India",https://www.mfarconstructions.com/,bd@mfarconstructions.com,Real Estate Builders in Koramangala Bangalore,Connector
V. R. R. Builders And Company,080 2553 3252,"206, 18th Main Rd, near Apollo Credal, KHB Colony, 6th Block, Koramangala, Bengaluru, Karnataka 560095, India",http://www.vrrbuilders.com/,sales@vrrbuilders.com,Real Estate Builders in Koramangala Bangalore,Connector
Diamond Developers,099800 62383,"87, 1st Ave, Teacher's Colony, Santhosapuram, 1st Block Koramangala, Koramangala, Bengaluru, Karnataka 560034, India",https://diamonddevelopers.in/,"info@diamonddevelopers.in, info@diamonddevelopers.com",Real Estate Builders in Koramangala Bangalore,Connector
Karan Property Developments Pvt Ltd,080 2222 6277,"480, 13th Main Rd, 3rd Block, Koramangala 3 Block, Koramangala, Bengaluru, Karnataka 560034, India",http://www.karanproperties.com/,info@karanproperties.com,Real Estate Builders in Koramangala Bangalore,Connector
Machani Group,080 4112 5838,"3rd Block, Bungalow 375, 13th Main Rd, Santhosapuram, Koramangala 3 Block, Koramangala, Bengaluru, Karnataka 560034, India",http://www.machanigroup.com/,,Real Estate Builders in Koramangala Bangalore,Connector
Golden Gate Properties Ltd,080 2570 5555,"Golden House, 820, 20th Main Rd, Koramangala 8th Block, Koramangala, Bengaluru, Karnataka 560095, India",http://www.ggproperties.com/,info@ggproperties.com,Real Estate Builders in Koramangala Bangalore,Connector
Ittina Group,097439 98111,"No. 380, Ittina Centre, 16th Main Rd, 3rd Block, Santhosapuram, 3 Block, Koramangala, Bengaluru, Karnataka 560034, India",http://www.ittina.in/,info@ittinagroup.com,Real Estate Builders in Koramangala Bangalore,Connector
Keya Homes Private Limited,080 4093 1141,"17, Regent Court, 80 Feet Rd, New Friends Colony, Koramangala, Bengaluru, Karnataka 560034, India",,,Real Estate Builders in Koramangala Bangalore,Connector
H K G N Building constructions and interior work,098806 58355,"#474 1st B main, 1st A cross Rd, KHB Colony, Koramangala 8th Block, Koramangala, Bengaluru, Karnataka 560095, India",,,Construction Companies in Koramangala Bangalore,Connector
TRC Engineering (I) Pvt. Ltd - Civil Engineering Services,080675 93000,"5th Block, 109, 1st Main Rd, 5th Block, Koramangala Industrial Layout, Koramangala, Bengaluru, Karnataka 560095, India",http://trcww.in/,info@trcintl.com,Construction Companies in Koramangala Bangalore,Connector
Alpha Ultra Projects,084312 25543,"144, 1st Floor, 60 Feet Rd, KHB Colony, 5th Block, Koramangala, Bengaluru, Karnataka 560095, India",https://alphaultraprojects.com/,info@alphaultraprojects.com,Construction Companies in Koramangala Bangalore,Connector
Anugraha Constructions,097380 51333,"467, 17th C Main Rd, KHB Colony, 5th Block, Koramangala, Bengaluru, Karnataka 560095, India",http://anugrahaconstructions.com/,,Construction Companies in Koramangala Bangalore,Connector
AG Buildcraft,080 4110 7123,"3rd Block, 734, 7th Cross Rd, Koramangala 4-B Block, Koramangala 3 Block, Koramangala, Bengaluru, Karnataka 560034, India",http://agbuildcraft.com/,"info@avantgardeestates.com, moore@support.com, moore@support.com ",Construction Companies in Koramangala Bangalore,Connector
Utracon Structural System Pvt Ltd.,097400 91919,"101, 6th Main Rd, New Friends Colony, S T Bed Layout, Koramangala, Bengaluru, Karnataka 560047, India",http://www.utraconindia.com/,,Construction Companies in Koramangala Bangalore,Connector
Artscape Developers,098801 70976,"8, Sarjapur Main Rd, Jakkasandra Extension, Koramangala, Bengaluru, Karnataka 560034, India",https://artscapedevelopers.com/,saurabh.gupta@artscape.co.in,Construction Companies in Koramangala Bangalore,Connector
Envoy Mortgage India Pvt. Ltd.,07139 778 005,"5th Floor, 7th Block, Koramangala, Bengaluru, Karnataka 560095, India",,,Mortgage Brokers in Koramangala Bangalore,Connector
